title,publication-date,event-date,country,location_x,lat_long,diseases,syndromes,url,id,cases_y,dead_y,disease_y,syndrome_y,location_y,keywords_y,Translated_Content
Russia reports world's first case of human infection with H5N8 bird flu,20/02/2021,20/02/2021,Russian Federation,,"55.757, 37.615","influenza a/h5n8, influenza b","severe acute respiratory syndrome, Influenza-like illness",https://crofsblogs.typepad.com/h5n1/2021/02/russia-reports-worlds-first-case-of-human-infection-with-h5n8-bird-flu.html,72,,,H5N8 bird flu,,Russia,first case,Error: Failed to fetch content after retries
"In Russia, identified seven cases of infection with a new strain of coronavirus ""centaur"" - RTVI",27/07/2022,,Russian Federation,,"55.757, 37.615",covid19,,https://rtvi.com/news/v-rossii-vyyavili-sem-sluchaev-zarazheniya-novym-shtammom-koronavirusa-kentavr/,73,7.0,,coronavirus,,Russia,"new, strain, cases","The share of the mutation “Omicron” -sttamma “Kentavar” (BA.2.75) in Russia “is still insignificant”, only seven cases throughout the country, TASS was told by the deputy head of the Central Research Institute of Epidemiology of Rospotrebnadzor Natalya Pshenichnaya.Moreover, other subspecies of the strain (in particular, BA.4 and Ba.5) are observed in 75% of the sick Covid-19.The increase in incidence is now not so rapid compared to January, when the Delta strain lost to Omicron, wheat noted.She referred to the opinion of foreign experts, who stated that those who were ill with the first options for Omicron, have preserved antibodies that protect against Ba.4/Ba.5 and Ba.2.75.The representative of Rospotrebnadzor also explained that the new variants of coronavirus infection are transferred to patients not harder than diseases for SARS, so hospitalization, as a rule, is not required.At the moment, sanitary restrictions in the country are currently not needed, but citizens should still be revaccinated once every six months, she added.Wheat recalled that usually ARVI or enterovirus infection was brought from vacation.Climate change, time zones often led to an increase in the body's vulnerability to various infections.Therefore, she recommended using the mask at the first signs of malaise.Rospotrebnadzor announced the first cases of a “centaur” in Russia on July 19.In addition to BA.2.75, other subspecies of Omicone are also common in the country - there is currently a flash of incidence in connection with the spread of the BA.5 virus.It is not worth expecting a new subspecies that the new subspecies will not be worth the “Omicron” of the Omicron, said Anatoly Altstein, professor of the NIC of epidemiology and microbiology named after Gamaley.The flash of incidence due to the “centaur” is unlikely to be stronger than the January wave, he explained."
"In the early years, 38 residents of the Fund were affected by dengue",21/01/2022,,Indonesia,"Papua, Pegunungan Bintang, Batam","-4.44, 140.909",dengue,,https://lemondediplomatique.com.mx/en-los-primeros-anos-38-vecinos-del-fondo-se-vieron-afectados-por-el-dengue/,74,38.0,,dengue,,,affected,Error: Failed to fetch content after retries
Ukraine registers the first case of infection with the variant omicron | Globe24.cz,19/12/2021,18/12/2021,Ukraine,,"50.448, 30.543",covid19,,https://globe24.cz/svet/ukrajina-registruje-prvni-pripad-infekce-variantou-omikron.2ddaa02e,75,1.0,,infection with the variant omicron,,Ukraine,first case,"Translation Error: the JSON object must be str, bytes or bytearray, not NoneType"
Bird flu 'very concerning' as Norfolk and Suffolk cases confirmed - BBC News,27/09/2022,,United Kingdom,,"51.5, -0.126",avian influenza/unspecified,,https://www.bbc.com/news/uk-england-suffolk-63033035,76,,,Bird flu,,Norfolk and Suffolk,confirmed,"High levels of bird flu infection, including new cases in Norfolk and Suffolk, are ""very concerning"", the chief veterinary officer has said. Incidents have been confirmed near Hadleigh, Suffolk and in Northwold and Honington, which are either side of the county border near Thetford, Norfolk. It follows outbreaks at Honington, Bury St Edmunds and Attleborough a week ago. Christine Middlemiss said it was vital biosecurity measures were followed to help prevent the spread of the virus. A 1.9-mile (3km) protection zone and a six-mile (10km) surveillance zone has been placed around all premises and the affected birds will be humanely culled, the Department for Environment, Food and Rural Affairs (Defra) said. ""It's certainly unusual to have this many [national] cases confirmed at this time of year. It's a disease we usually see in the winter when migratory birds return from where they've been over the summer,"" said Ms Middlemiss. ""It's a very concerning level of infection out there at the moment."" She added a ""huge amount of infection"" earlier this year led to a disease ""hangover"" in the summer among wild birds which do not migrate. ""That's why we're seeing these clusters pop up,"" she explained. ""[A case of bird flu] usually means there's a regional really high level of wild bird infection and those birds have gone to different farms and caused infection there."" She added keepers of birds needed to make sure they were ""clean all the time"" during day-to-day tasks with their birds, including cleaning footwear when going from coop to coop. Defra has previously said the virus was ""primarily a disease of birds and the risk to the general public's health is very low"". Find BBC News: East of England on Facebook, Instagram and Twitter. If you have a story suggestion email eastofenglandnews@bbc.co.uk Diane Hele gets West Suffolk hospital's Midwife of the Year award - given in memory of a late midwife. A coroner will examine the death of Malik Bunton at RAF Leeming in July 2023. Suffolk Fire and Rescue Service used a pet-friendly mask to help the rodent after the bedroom blaze. The trust in charge of the hospital predicts a deficit of £28.5m at the end of this financial year. ITFC going toe-to-toe with United, Panto in Bury, Christmas lights in Ipswich and coastal sunsets. Copyright 2024 BBC. All rights reserved.  The BBC is not responsible for the content of external sites. Read about our approach to external linking."
"The symptoms and causes of monkeypox infections, which CDC calls an ' emerging issue'",20/05/2022,,United Kingdom,,"51.5, -0.126",Mpox,,https://www.nbcnews.com/health/health-news/monkeypox-virus-symptoms-rcna29510,77,,,monkeypox,,,emerging issue,"Translation Error: the JSON object must be str, bytes or bytearray, not NoneType"
INDIA - Munger - Bihar Logs 13 New Dengue Cases In 24 Hours,1/12/2022,,India,"Bihar, Khagaria, Khagaria","25.506, 86.467",dengue,,http://outbreaks.globalincidentmap.com/event_detail?id=11919674,78,13.0,,Dengue,,"Munger, Bihar",new,Don't have an account?                                                              Register
"National Health Commission: 164 new confirmed cases of new coronavirus pneumonia on July 22, including 128 local cases - China Net News Center;",23/07/2022,,China,,"39.931, 116.386",covid19,,http://news.china.com.cn/2022-07/23/content_78337567.htm,79,164.0,,new coronavirus pneumonia,,China,"new, confirmed","Xinhua News Agency, Beijing, July 23rd. The National Health and Health Commission reported on the 23rd that at 0-24:00 on July 22, 31 provinces (autonomous regions, municipalities) and Xinjiang Production and Construction Corps reported 164 cases of new crown pneumonia.Among them, 36 cases of overseas input cases (9 cases in Fujian, 8 cases in Guangdong, 5 cases in Tianjin, 4 cases in Shanghai, 4 cases in Sichuan, 2 cases in Chongqing, 1 case in Beijing, 1 case in Inner Mongolia, 1 case in Shandong, 1 in Shaanxi), including 6)Examples from asymptomatic infections to confirmed cases (3 cases in Fujian, 2 cases in Guangdong, and 1 case of Tianjin); 128 local cases (42 cases in Gansu, 35 cases in Guangxi, 23 cases in Guangdong, 11 cases in Sichuan, 7 cases in Anhui, Chongqing3 cases, 2 cases in Shanghai, 2 cases in Jiangxi, 1 case in Beijing, 1 case of Henan, and 1 case of Yunnan), including 31 cases from asymptomatic infections to confirmed cases (18 cases in Gansu, 10 cases in Guangxi, 1 case in Anhui, Guangdong1 case, 1 case of Yunnan).There are no new death cases.There are 3 new suspected cases, all of which are overseas input cases (both in Shanghai).There were 97 cases of newly increased hospitalization on the day, including 32 cases of overseas input cases, 65 cases of local cases (14 cases in Gansu, 10 cases in Guangdong, 9 cases in Shanghai, 8 cases in Anhui, 6 cases in Jiangsu, 5 cases in Shandong, 5 cases in Henan, Fujian in Fujian, FujianTwo cases, 2 cases in Hainan, 1 case in Beijing, 1 case of 1 case in Inner Mongolia, 1 case of Jiangxi, 1 case in Guangxi), 19,731 close contacts of medical observations, and 6 cases of severe cases increased from the previous day.There were 534 existing confirmed cases overseas, and 3 cases of suspected cases were input.A total of 20,318 confirmed cases were cumulative, and 19,784 cases were cured and had no death cases.As of 24:00 on July 22, according to the reports of 31 provinces (autonomous regions, municipalities) and Xinjiang Production and Construction Corps, there were 1751 cases of confirmed cases (including 14 cases of severe cases), and 221,542 cases were cured.A total of 22,8519 cases were reported to the accumulated report, and there were 3 suspected cases.A total of 452,7808 people were tracked to the close contact, and 10,3056 close contacts were still observed in medical observation.31 provinces (autonomous regions, municipalities) and Xinjiang Production and Construction Corps reported 653 cases of asymptomatic infection, of which 59 cases were entered overseas, 594 cases of 594 (329 cases in Gansu, 174 cases in Guangxi, 19 cases in Henan, 16 cases in Shanghai, Anhui16 cases, 10 cases in Sichuan, 9 cases in Tianjin, 9 cases in Guangdong, 7 cases in Yunnan, 4 cases in Jiangxi, and 1 case of Chongqing).There were 314 asymptomatic infected from medical observation that day, of which 37 cases were entered overseas, 277 cases of 277 (57 cases in Jiangsu, 48 cases in Anhui, 44 cases in Shanghai, 43 cases in Shandong, 26 cases in Guangxi, 26 cases in Gansu, 14 cases in Henan, Henan, and Henan.10 cases in Fujian, 4 cases in Jiangxi, 3 cases in Guangdong, 1 case of Liaoning, 1 case of Zhejiang); 37 cases of confirmed cases on the day (6 cases in overseas input); 5783 cases of non -symptoms who were observed in medicine (444 overseas input 444example).A total of 473,6370 cases were notified in Hong Kong, Macao and Taiwan.Among them, 349,298 cases of Hong Kong Special Administrative Region (66,336 cases were discharged from hospital, 9,454 deaths), 783 cases of 783 cases of Macau Special Administrative Region (367 cases were discharged from hospital, 6 deaths), and 43,86289 cases in Taiwan (13,742 cases were discharged and 8478 deaths).About Us | Foreign Propaganda Service and Advertising Services |Illegal and bad information report Tel: 010-88828271 Reporting Process All rights reserved China Internet News Center Email: News@china.org.cn Tel: 86-10-88828000 Beijing ICP Certificate 0400890105123"
"The state's top-down daily infections, detected in 24 hours...",7/10/2022,,India,Odisha,"20.513, 84.429",covid19,,https://www.prameyanews7.com/new-covid-cases-in-odisha-2/,80,,,,,,,Error: Failed to fetch content after retries
"National Health Commission: 4,233 new local confirmed cases yesterday and 30,539 new local asymptomatic infections - Shanghai Securities News;",3/12/2022,,China,,"40.05, 116.286",covid19,,"https://news.cnstock.com/news,bwkx-202212-4988870.htm",81,4233.0,,,,Shanghai,new,"Shanghai Securities News China Securities Network News According to the National Health and Health Commission on December 2, at 0-24 on December 1, 31 provinces (autonomous regions, municipalities) and Xinjiang Production and Construction Corps reported 4,278 new new crown pneumonia.Among them, 45 cases of overseas input cases (16 cases in Guangdong, 8 cases in Fujian, 6 cases in Beijing, 4 cases in Shanghai, 3 cases in Jiangxi, 2 cases in Chongqing, 1 case of 1 case in Inner Mongolia, 1 case of Liaoning, 1 case of Heilongjiang, 1 case in Shandong, 1 case of Hubei 1 case, 1 case in Sichuan), including 5 cases from asymptomatic infections to confirmed cases (3 cases in Guangdong, 1 case in Beijing, 1 case in Fujian); 4233 cases of local cases (Guangdong 1782 cases, 942 cases in Beijing, 193 cases in Shanxi, Chongqing, Chongqing, Chongqing, Chongqing, and Chongqing189 cases, 173 cases in Yunnan, 169 cases in Sichuan, 114 cases in Zhejiang, 87 cases of Heilongjiang, 83 cases in Fujian, 81 cases in Henan, 68 cases in Shaanxi, 55 cases in Inner Mongolia, 49 cases in Liaoning, 42 cases in Shandong, 30 cases in Hunan, 27 cases in Jiangsu, 26 cases in Shanghai, 26 cases in Hainan, 20 cases in Hubei, 18 cases in Hebei, 12 cases in Guizhou, 11 cases of Xinjiang, 10 cases of Jilin, 9 cases in Guangxi, 9 cases in Qinghai, 4 cases in Anhui, 1 case of Tianjin, 1 case in Jiangxi, Tibet1 case, 1 case of Ningxia), containing 1089 cases from asymptomatic infections to confirmed cases (824 cases in Guangdong, 64 cases in Chongqing, 61 cases in Zhejiang, 41 cases in Yunnan, 26 cases in Beijing, 17 cases in Fujian, 13 cases in Sichuan, Guangxi8 cases, 7 cases in Shaanxi, 6 cases in Liaoning, 6 cases in Qinghai, 5 cases in Henan, 4 cases in Shanxi, 2 cases in Jiangsu, 1 case in Anhui, 1 case in Shandong, 1 case in Hainan, 1 in Guizhou, 1 case in Ningxia).There are no new death cases.No new suspected cases.There were 2877 cases of newly cured hospitals that day, of which 85 cases were entered overseas, 2792 cases of local cases (1326 cases in Guangdong, 310 in Beijing, 186 cases in Chongqing, 175 cases in Shanxi, 166 cases in Hebei, 127 cases in Sichuan, 84 cases in Henan, Inner Mongolia, Inner Mongolia77 cases, 60 cases in Jiangsu, 40 cases in Yunnan, 36 cases in Heilongjiang, 26 cases in Zhejiang, 21 cases in Fujian, 21 cases in Shandong, 20 cases in Guizhou, 19 in Shaanxi, 15 cases in Hunan, 15 cases in Xinjiang, 12 cases in Qinghai, 10 cases in Liaoning 10 cases, 9 cases in Shanghai, 8 cases of Gansu, 7 cases in Hainan, 6 cases in Jiangxi, 5 cases of Jilin, 4 cases in Hubei, 3 cases in Tianjin, 2 cases of Guangxi, 2 cases in Ningxia), 253,944 close contacts with medical observations, and severe casesOne case was reduced from the previous day.There were 736 existing confirmed cases overseas (non -severe cases), and there were no suspected cases.A total of 2,766 cases were accumulated, and 26,925 cases were cured in accumulatively cured, and there were no death cases.As of 24:00 on December 1st, according to the report of 31 provinces (autonomous regions, municipalities) and Xinjiang Production and Construction Corps, there were 38,748 cases of confirmed cases (including 98 cases of severe cases), 283,983 cases of cure for discharge were cured, and 5233 cases accumulated deaths were accumulated.A total of 32,7964 cases were reported to the accumulated report, and there were no suspected cases.A total of 1327,3513 people were tracked to the close contact, and the close contact with medical observation 2076029.31 provinces (autonomous regions, municipalities) and Xinjiang Production and Construction Corps reported 30,702 cases of asymptomatic infection, of which 163 cases were entered overseas, 30,539 cases were localized (6347 cases in Chongqing, 6010 cases in Guangdong, 3026 cases in Beijing, 2320 cases in Shanxi, Sichuan Sichuan, Sichuan1047 cases, 1032 cases in Yunnan, 812 cases in Xinjiang, 799 cases in Shaanxi, 706 cases in Hubei, 689 cases in Tianjin, 688 cases in Qinghai, 685 cases in Guangxi, 660 cases in Heilongjiang, 623 in Shandong, 523 cases in Jiangsu, 513 cases in Liaoning, and 477 cases of Jilin 477 cases., Ningxia 437 cases, 396 cases in Gansu, 380 cases in Anhui, 356 cases in Hebei, 337 cases in Inner Mongolia, 317 cases in Hunan, 298 cases in Zhejiang, 291 cases in Henan, 240 cases in Guizhou, 209 cases in Shanghai, 156 cases in Fujian, 76 cases in Hainan, Jiangxi in Jiangxi66 cases, 16 cases in Tibet, and 7 cases of corps).There were 21,981 cases of non -symptoms of medical observation that day, of which 153 cases were entered overseas, 21,828 localities (5625 cases in Guangdong, 5059 cases in Chongqing, 2365 cases in Hebei, 1371 in Beijing, 1172 cases in Xinjiang, 803 cases in Henan, 695 cases in Shanxi, Shanxi 695 cases, 695 cases in Shanxi.435 cases in Shaanxi, 413 in Shandong, 379 cases in Hunan, 379 cases in Sichuan, 327 cases in Gansu, 324 cases in Qinghai, 281 cases in Inner Mongolia, 280 cases in Ningxia, 276 cases in Heilongjiang, 276 cases in Jiangsu, 274 cases in Hubei, 195 cases in Jilin, Guangxi 171For example, 164 cases in Tianjin, 103 cases of Yunnan, 98 cases in Liaoning, 72 cases in Anhui, 70 cases in Jiangxi, 55 cases in Guizhou, 54 cases in Shanghai, 49 cases in Zhejiang, 23 cases in Fujian, 21 cases in Tibet, Hainan 15 cases, 4 cases of corps); 1094 cases of confirmed cases on the day (5 cases of inputs overseas); 396094 cases of non -symptoms observed in medical observation (1761 cases were entered overseas).A total of 879,0364 cases were notified in Hong Kong, Macao and Taiwan.Among them, 460,548 cases of Hong Kong Special Administrative Region (99,432 cases were discharged from the hospital, 10,762 deaths were killed), and 808 cases of 808 Special Administrative Regions (791 cases were discharged from hospital), and 832,9008 cases in Taiwan (13,742 cases were discharged and 14,387 deaths were killed)."
"Shanghai, May 23, 2022, 58 new local covid-19 pneumonia confirmed cases, 422 new local asymptomatic infected people, 422 cases of no new overseas ...",24/05/2022,,China,,"39.931, 116.386",covid19,,https://wsjkw.sh.gov.cn/xwfb/20220524/8aca9ba6f316476d8817b57056305352.html,82,58.0,,covid-19 pneumonia,,Shanghai,"new, local",Error: Failed to fetch content after retries
"Globally, covid infections surpass 628 billion cases, over 65600000 deaths - RYT9",14/10/2022,,Brazil,,"-15.78, -47.929",covid19,,https://www.ryt9.com/s/iq38/3364846,83,62800000000.0,65600000.0,covid infections,,,surpass,"International news, Thursday October 13, 2022 23:54-US (IQ) of the US (IQ) has the highest-98,727,136 virus virus (98,727,136), followed by India (44,621,319).There are more than 36 million people who are infected, including France, a country with more than 34 million infected people, namely Brazil Germany, a country with more than 25 million infected people, such as South Korea, a country with a number.More than 23 million people are infected, including the United Kingdom.A country with more than 22 million people with infections, namely Italy, a country with more than 21 million people, such as Japan, Russia, a country with more than 16 million infected, such as Turkey.More than 13 million people are infected, such as Spain, a country with more than 11 million people with Vietnam, which is more than 10 million people with Australia. In addition, the United States is a country.The maximum death in the world (1,089,385) followed by Brazil (687,076) India (528,847) Copyright © 2007-2024 Dataxet Limited (Data Set Join). All rights reserved.SCOM (3.7)| Service agreement  This website uses cookies.Learn more atPrivacy policyAnd the service of using the service"
Getting Answers: doctors seeing rise in gastroenteritis cases - Western Mass News,19/11/2022,,United States,,"38.89, -77.032",,Acute gastroenteritis,https://www.westernmassnews.com/2022/11/18/getting-answers-doctors-seeing-rise-gastroenteritis-cases/,84,,,,gastroenteritis,,rise,"SPRINGFIELD, MA (WGGB/WSHM) - With cold and flu season ramping up, healthcare workers across the Bay State are seeing a rise in all sorts of viruses and illnesses, including gastroenteritis. Gastroenteritis, commonly known as the stomach flu, is one of the many viruses that is getting us sick this cold and flu season. While it is not uncommon, many health experts we spoke with said they are expecting to see it in higher amounts than normal this winter season. ""Of the stomach virus, or gastroenteritis, we are seeing that mixed in with a whole bunch of other things that is going around, such as the flu or even COVID, which can often present with very similar symptoms,"" said Lawrence Benjamin, a physician assistant with AFC Urgent Care. Benjamin told us although it's often referred to as the stomach flu, that can be misleading since the virus is not related to influenza. ""We do get vaccinated against Influenza A and B, hopefully, and it does cause similar symptoms and it can just be GI symptoms or gastroenteritis symptoms...No, the influenza vaccines, the flu A and B vaccines, won't really protect you against gastroenteritis,"" Benjamin added. Some common gastroenteritis symptoms are stomach cramps, nausea or vomiting, and fever. Benjamin told Western Mass News that the stomach flu can look like other infections, like the flu or COVID-19, and often increase this time of year. ""With every seasonal change, you can always expect an increase in any infection related to season prevalence, including the stomach bug,"" Benjamin noted. Benjamin said the best way to prevent getting seriously sick this season is to get your COVID-19 and flu vaccines. He also said it's important because it is possible to get more than one of these illnesses at the same time. Copyright 2022. Western Mass News (WGGB/WSHM). All rights reserved."
Bird flu can thwart Christmas in England | MedikForum.ru,1/10/2022,,United Kingdom,,"51.5, -0.126",avian influenza/unspecified,,https://www.medikforum.ru/medicine/140314-ptichiy-gripp-mozhet-sorvat-v-anglii-rozhdestvo.html,85,,,Bird flu,,England,thwart Christmas,"Leave a comment 18+ © 2024. Electronic periodical news from Medforum.Registered by the Federal Service for Supervision of Communications, Information Technologies and Mass Communications (Roskomnadzor).Certificate of EL NO FS77-39067 dated March 09, 2010 Founder: Medforum LLC, editor-in-chief: Igor Petrov, Director of Advertising: Lyudmila Ovcharova. Administration: 107564, Moscow, st.Krasnobogatyrskaya, 42. Phone: +7 (495) 970-02-22, e-mail: Medikforum@yandex.ru.All rights are protected.Copying and using full materials is prohibited, partial citation is possible only if hyperlinks on the site www.medikforum.ru.Information on the site is presented exclusively for introductory purposes.Consultation with your doctor is needed before using any drug, drug, treatment or procedure."
"Coronavirus Cases Today: In the last 24 hours, 1260 corona cases were reported in the country.",2/04/2022,,India,"Punjab, Ludhiana, Ludhiana, Punjabi Bagh","30.929, 75.879",covid19,,https://punjabi.abplive.com/news/india/coronavirus-cases-today-india-reports-1260-new-corona-cases-and-83-deaths-in-last-24-hours-650194,86,1260.0,,corona,,country,"today, reported, cases",No content found
2 new cases of COVID-19 pneumonia and 1 case of local asymptomatic infection in Shanghai - Shanghai Municipal Health Commission;,15/06/2022,,China,"Shanghai, Shanghai","31.218, 121.435",covid19,,http://wsjkw.sh.gov.cn/xwfb/20220614/65cf5cddea8b42fdaa502b3b11dd20ff.html,87,3.0,,COVID-19 pneumonia,local asymptomatic infection,Shanghai,new,Error: Failed to fetch content after retries
Fever in the state - two in Prakasam and a child died in Sathya Sai | Prajasakti,10/09/2022,,India,,"28.632, 77.219",dengue,,https://prajasakti.com/dengue-fever-deaths,88,,2.0,,Fever,Prakasam,died,Error 404: Page not found
South Dakota reports 1st UK Coronavirus Variant B.1.1.7 cases,12/03/2021,11/03/2021,United States,South Dakota,,covid19,,http://outbreaknewstoday.com/south-dakota-reports-1st-uk-coronavirus-variant-b-1-1-7-cases-38879/,89,1.0,,UK Coronavirus Variant B.1.1.7,,South Dakota,cases,Error: Failed to fetch content after retries
"CIDRAP - Delta COVID variant surges in Asia, casts shadow on Olympics",8/07/2021,,United States,,,covid19,,https://flutrackers.com/forum/forum/local-regional-communities-and-organizations/cidrap/918999-cidrap-delta-covid-variant-surges-in-asia-casts-shadow-on-olympics,90,,,Delta COVID variant,,,"surges, casts shadow on Olympics",No content found
