title,publication-date,event-date,country,location_x,lat_long,diseases,syndromes,url,id,cases_y,dead_y,disease_y,syndrome_y,location_y,keywords_y,Translated_Content
Health chiefs warn Brits to stay off school or work if feeling ill as winter bugs surge,3/01/2023,,United Kingdom,,"51.5, -0.126",covid19,,https://www.mirror.co.uk/news/uk-news/health-chiefs-warn-brits-stay-28856890,1,,,,,,"winter bugs, surge","Brits have been told to stay off work or school if unwell amid surging winter bugs - with hospital flu cases nearly doubling in a week. The UK Health Security Agency has issued the advice as schools and workplaces reopen after the festive break.  It comes amid high and increasing rates of flu, Covid-19, norovirus, scarlet fever and versions of the common cold. Prof Susan Hopkins, UKHSA chief medical adviser, said: ""It's important to minimise the spread of infection in schools and other education and childcare settings as much as possible.  ""If your child is unwell and has a fever, they should stay home from school or nursery until they feel better and the fever has resolved. ""Adults should also try to stay home when unwell and if you do have to go out, wear a face covering. When unwell don't visit healthcare settings unless urgent, or visit vulnerable people."" Low levels of natural immunity following three years of restricted social mixing are thought to be contributing to a high flu season. Patients in hospital with flu have increased 79% in a week.  An average of 3,746 people with flu were in hospital across the seven days to 25 December, up from 2,088 the previous week, according to NHS England.  Covid rates are rising with a 22% increase in hospital admissions recorded in England between 7 and 14 December.  A host of infections are also circulating such as rhinovirus, metapneumovirus, parainfluenza and seasonal coronaviruses that can cause fever, sore throat, ear infections, headaches and coughing.  The UKHSA is calling on parents to teach young children how to wash their hands properly. Prof Hopkins said: ""Helping children to learn about the importance of good hand hygiene is also key, so practise regular hand washing at home with soap and warm water. ""Catching coughs and sneezes in tissues then binning them is another simple way to help stop illness from spreading."" Strep A infections are circulating which can lead to scarlet fever and in very rare cases, serious complications.  At least 30 children have died in the UK from invasive strep A since September - which has triggered a run on hospitals and GP surgeries from concerned parents.  The main strain of influenza circulating in the UK is H3N2, which has been linked to more severe disease, particularly in vulnerable groups such as elderly people and young children. The current flu vaccine broadly covers this strain. Those eligible include children aged 2 and 3 on 31 August 2022, all primary school-aged children and some secondary school-aged children. Prof Hopkins added: ""Remember that flu vaccination is still available for all eligible groups and is the best protection against the virus. We have seen good uptake in older age groups but vaccination among young children remains low. ""Flu can be very unpleasant and in some cases can lead to more serious illness. Getting your child vaccinated protects them and others they come into contact with and it's still not too late."" Get email updates with the day's biggest stories"
"Coronavirus in India: 42909 new cases in 24 hours, 380 killed, 29836 people infected in Kerala alone",31/08/2021,29/08/2021,India,Sikkim,"27.57, 88.477",covid19,,https://gujarati.news18.com/news/national-international/covid19-in-india-coronavirus-mofhw-data-30-august-2021-vaccination-in-india-mb-1128832.html,2,42909.0,380.0,Coronavirus,,India,new,"A total of 52,01,46,525 corona samples have been tested in the country.(Ap Photo/Channi Anand) Covid-19 Live Updates India, 30 August 2021: On the first day of the week, on Monday, new cases of Corona virus have increased the tension of the countrymen.The most worrying situation is in Kerala and then in Maharashtra.In India, more than 42 thousand people have been infected in the last 24 hours, with 29,836 cases in Kerala and 46666 cases in Maharashtra.In Kerala, the transition has dropped slightly for a few days and the death toll has also decreased.In Kerala, 75 patients have lost their lives in one day and 131 patients in Maharashtra.On the other hand, before the festive celebration in Gujarat, the situation of the corona is somewhat overcome.New cases in the country are scared Monday morning, according to data released by the Ministry of Health, 42,909 new cases in the country have been reported in the last 24 hours.In addition, 380 patients have lost their lives due to Kovid-19 (Covid-19).The total number of transit in the country has now increased to 3,27,37,939.On the other hand, a total of 63,43,81,358 people in the country have been given a dose of Corona Vaccine (Covid19 Vaccine Campaign).In the last 24 hours, 31,14,696 corona vaccines have been given doses.Covid Recovery Rate in India has decreased Kovid-19 pandemic, with 3 million 19 lakh 23 thousand 405 people in India.34,763 patients have been discharged in 24 hours.Recovery rate in India is currently 97.50 %.There are currently 3,76,324 active cases.So far, a total of 4,38,210 people have died due to corona virus.According to the data released by the Indian Council of Medical Research (ICMR), a total of 52,01,46,525 corona samples have been tested by August 29, 2021.14,19,990 samples have been tested in the 24 hours of Sunday.Also Read, Covid-19: The risk of blood clotting on Corona patients than those who vaccine, the findings of new study in Gujarat are steadily declining in Kovid recovery rate 98.76 % of Gujarat.In the last 24 hours, there have been 10 new cases of Corona virus.Against which 14 patients have been healed.Not a single patient died due to Kovid-19 in the state in the last 24 hours.The total death toll in the state is 10081.The rate of healing in the state is 98.76 %.So far 4,54,69,490 doses have been given to corona vaccines.A total of 4,32,039 persons have been vaccinated in the last 24 hours.Also Read, Explained: Why is the Corona Delta variant more infectious and deadly?Research revealed 10 cases of new corona virus case in Gujarat, 1 in Surat, 1 in Vadodara, 3 in Vadodara, 1-1 in the ocean.Not a single patient died due to a corona within 24 hours in the state.On the other hand, 4 patients in Ahmedabad, 2 in Vadodara, 5 in Vadodara, Amreli, Bhavnagar, Dahod have given the Corona virus.There are currently 151 active cases in the state, of which 4 patients are on ventilators.There are 147 patients stable in the state.So far 815154 patients have been discharged in the state.Follow us on download News18 App"
"One death each due to dengue, malaria in Delhi this year: Civic body report",22/12/2020,22/12/2020,India,"Delhi, New Delhi, New Delhi","28.632, 77.219","dengue, malaria",,https://www.indiatvnews.com/news/india/delhi-dengue-malaria-chikungunya-cases-delhi-vector-borne-diseases-data-673060,3,,1.0,"dengue, malaria",,Delhi,,"Translation Error: the JSON object must be str, bytes or bytearray, not NoneType"
Russia recorded a sharp increase in COVID-19 infections - DW,7/02/2022,,Russian Federation,,"55.757, 37.615",covid19,,https://www.dw.com/ru/fiksirovano-nebyvaloe-chislo-zarazhenij-covid-19/a-60672855,4,,,COVID-19,,Russia,increase,"In the Russian Federation, the number of diseases by coronavirus continues to grow, which, as epidemiologists warned, is associated with the spread of the Omicron version.In Russia, the daily increase in new cases of coronavirus was 177,282 infection.This is 9,000 more than the day earlier.18,032 people were hospitalized per day - 1.3 percent higher than the previous day.The number of coronavirus cured after infection in Russia increased by 60 507 against 58,449 a day earlier.In total, 109,688 cases of recovery have been registered in the country from the beginning of the pandemic in the country.These are the data of the Federal Operational Staff, published on Saturday, February 5.Most of the infection was detected in Moscow-23,784, which is noticeably lower than the maximum of 26,586, recorded on January 27. A new maximum of infection of 19,234 was registered in St. Petersburg. A day earlier, 13,619 infected were identified there.Meanwhile, the number of the Moscow region, the number of patients decreased to 10 188 versus 11,475 a day earlier.60 507 people recovered per day, or 3.5 percent more compared to February 4.In total, 12,630,047 cases of incidence of Covid-19, 334 753 of the dead and 10,509,688 recovered were recorded in Russia since the beginning of the pandemic.A sharp increase in the incidence of coronavirus in the Russian Federation began on January 13, when 21,155 sick were revealed in a day.On January 12, 17,946 sick were reported.After that, daily the number of new cases of infection per day continued to increase.A strong increase was recorded on January 21, when the number of cases increased by more than 10,000 per day compared to the data of the opera station, published on January 20.As epidemiologists warned, the situation with incidence develops dynamically and towards growth, which is associated with the spread of the Omicron version.According to the operational headquarters, the spread of Omcron is recorded in 84 regions of the country.The day before it was reported that the new version of coronavirus was discovered in 83 regions of the Russian Federation.The number of those who died from coronavirus per day from January 16 remains approximately at the same level.It amounted to 714 people.According to Rospotrebnadzor on Saturday, more than 261 million tests on Covid -19 were held in Russia, of which 1.2 million - over the past day.Under medical supervision in the country, 4,519,493 people remain.See also: to view This Video Please Enable JavaScript, and Consider Upgrading to A Web Browser that Supports HTML5 Video"
"Covid-19 pneumonia situation in Chongqing on July 12, 2022;",12/07/2022,,China,Chongqing,"30.058, 107.874",covid19,,http://wsjkw.cq.gov.cn/ztzl_242/qlzhxxgzbdfyyqfkgz/yqtb/202207/t20220712_10908673.html,5,,,Covid-19,pneumonia,Chongqing,,Error 404: Page not found
"Sydney COVID-19 cases set to rise, hospitals under pressure | Reuters",17/08/2021,17/08/2021,Australia,"New South Wales, Sydney, Sydney","-33.873, 151.205",covid19,,https://www.reuters.com/world/asia-pacific/australias-victoria-reports-slight-rise-local-covid-19-cases-2021-08-16/,6,,,COVID-19,,Sydney,rise,Error 401: Unauthorized
"Dengue: With the onset of summer, pathankot started increasing...",10/06/2022,,India,"Punjab, Pathankot, Pathankot","32.26, 75.632",dengue,,https://punjab.news18.com/news/punjab/pathankot/pathankot-dengue-cases-in-pathankot-on-the-rise-with-the-onset-of-summer-js-rup-as-local18-347589.html,7,,,Dengue,,,increase,Error 404: Page not found
National Health Commission: 9 new crown pneumonia confirmed cases 14 cases are imported cases from abroad;,11/04/2021,11/04/2021,China,,"39.931, 116.386",covid19,severe acute respiratory syndrome,https://finance.sina.com.cn/tech/2021-04-10/doc-ikmyaawa8845224.shtml,8,9.0,,crown pneumonia,,,new,"Original title: National Health and Health Commission: 14 cases of new crown pneumonia on the 9th are all overseas input case Xinhua News Agency, Beijing April 10th.The province (autonomous region, municipality) and Xinjiang Production Construction Corps reported 14 newly confirmed cases, all of which were overseas input cases (4 cases in Shanghai, 2 cases in Fujian, 1 case in Beijing, 1 case of Shanxi, 1 case in Zhejiang, 1 case in Zhejiang, Shandong1 case, 1 case in Hubei, 1 case of Yunnan, 1 case of Shaanxi); no new death cases; no suspected suspected cases.10 cases of newly cured hospitals on the day, 309 close contacts of medical observations were lifted, and severe cases were the same as the previous day.199 cases of existing confirmed cases were entered overseas (2 cases of severe cases), and 2 cases of suspected cases.A total of 5,411 confirmed cases, 5,212 cases of cure for hospitalization, and no death cases.As of 24:00 on April 9, according to the reports of 31 provinces (autonomous regions, municipalities) and Xinjiang Production and Construction Corps, there were 283 cure cases (including 3 cases of severe cases), 8,5481 cases were cured, and 4,636 cases accumulated deaths were cumulative.There were 90400 confirmed cases, and 2 cases of suspected cases were reported.A total of 995588 people were tracked to the close contact, and 7,384 close contacts who were observed in medical observation.31 provinces (autonomous regions, municipalities) and Xinjiang Production and Construction Corps reported 11 asymptomatic infections (all of them were inputs overseas); 3 cases were converted to confirmed cases on the same day; 16 cases of medical observation were lifted on the same day (16 cases of medical observation (Both are overseas input); 285 cases of disagreals are still observed in medical observation (260 cases of input overseas).A total of 1,2666 cases were notified in Hong Kong, Macao and Taiwan.Among them, there were 11,563 cases of 11,563 Special Administrative Regions (11,186 cases of discharge, 207 deaths), and 49 cases of 49 cases of Macau Special Administrative Region (48 cases were discharged), and 1054 cases in Taiwan (1018 were discharged from hospital and 10 deaths).""Palm"" Holding Technology Fresh (WeChat Search Techsina or Scan the left QR code attention) Sina Technology Sina Technology brings you the freshest technology information Apple Hui Apple Hui brings you the freshest Apple product news Sina public testNew cool product will try Sina for free to explore the latest scientist news, wonderful shocking pictures Sina Technology Opinion Feedback Message Board: 400-052-0066 Welcome to criticize Correct Sina| Questions of Pass Registration Products | Website Lawyers | Sina English Copyright © 1996-2021 Sina Corporation All Rights Reserve"
For reprint print: Syndication Service,2/05/2021,,India,Karnataka,"14.71, 76.168",covid19,,https://www.thejasnews.com/news/india/covid-status-karnataka-169458,9,,,,,,,"Bengaluru: Cowid disgustingness is on top of 40,000 daily estimates in Karnataka.The people have confirmed the disease in the state today.Today, 271 have died due to disease.With this, the total number of patients in the state rose to 15,64,132.The number of treatment is currently affected by 4,05,068.The only relief of the patient's number was decreased in the list of cowdners of the last day.The number of patients today in Andhra Pradesh and Tamil Nadu.In Rajasthan, in the 17th century, the disease was confirmed today.© Copyrights 2020. All Rights Reserved.Powered by Hocalwire"
in the Chelyabinsk region announced a quarantine for bird flu - 74.RU,25/09/2021,,Russian Federation,"Ural Federal District, Chelyabinsk Oblast, Chelyabinsk","55.16, 61.394",influenza b,,https://74.ru/text/animals/2021/09/24/70155899/comments/,10,,,bird flu,,Chelyabinsk region,quarantine,"Now 2 ° C is cloudy, without precipitation it is felt like -7 0 m/s, repair of washing and dishwashers at home.Professional!0 ₽ I will buy a power cable, control, telephone, from storage, non -exchanging, expensive 1,000 000 ₽ Evaluation and purchase of old items 1,000 000 ₽ Information about age -related restrictions on information products, subject to distribution on the basis of the norms of the Federal Law “On Protection of Children frominformation causing harm to their health and development. ”Some materials of this section may contain information prohibited for children."
"Brazil sees 2 confirmed omicron cases, Latin America’s 1st",30/11/2021,30/11/2021,Brazil,,"-15.779, -47.926",covid19,,https://flutrackers.com/forum/forum/south-america-aa/south-america-covid-19-sept-13-2020-may-31-2021/929495-brazil-sees-2-confirmed-omicron-cases-latin-america’s-1st,11,2.0,,omicron,,,confirmed,No content found
3 new confirmed cases of human infection with avian influenza in the Mainland;,10/03/2022,,China,Guangxi,"23.833, 108.789","influenza a/h9n2, influenza a/h5n6",,https://www.gov.mo/zh-hans/news/595716/,12,3.0,,avian influenza,,the Mainland,new,"The Health Bureau said that according to the latest notification of the mainland health department, 2 new human infection H5N6 and 1 case of human infection H9N2 avian influenza were added in the Mainland.The Health Bureau called on residents to avoid contact with birds and pay attention to personal and food hygiene.According to information, in the two cases of human infection with H5N6 bird flu, 1 man and 1 woman, aged 12 and 79, came from Liuzhou City, Guangxi Zhuang Autonomous Region; two people died; they had reached the live poultry market before the onset.The case of a human infection with H9N2 bird flu is a 6 -year -old girl, who lives in Yangquan City, Shanxi Province.Since April 2014, there have been H5N6 or H9N2 bird flu diagnosis in Sichuan, Guangdong, Yunnan, Hubei, Shanxi, Hunan, Anhui, Guangxi Zhuang Autonomous Region and Jiangsu.The Health Bureau will continue to keep close connections with the health departments and World Health Organizations of the state and nearby regions, and closely monitor the epidemic conditions in various places and Macao.In order to prevent human infection with bird flu, the Health Bureau calls on the public to pay attention to the following matters: information about avian influenza, you can check the webpage of the Health Bureau (www.ssm.gov.mo) or call the Health Bureau infectious disease query hotline 28561122 during office hours.Print this page news-1-595716"
7 new cases of local COVID-19 pneumonia confirmed in Beijing_Xinhua Newspaper Network;,8/03/2022,,China,"Beijing, Beijing, Haidian","39.992, 116.277",covid19,,http://www.xhby.net/zt/zzccfkyq/yw/202203/t20220308_7455807.shtml,13,7.0,,COVID-19 pneumonia,,Beijing,new,"3月8日,在北京市新型冠状病毒肺炎疫情防控工作第285场新闻发布会上,市疾控中心副主任、全国新型冠状病毒肺炎专家组成员庞星火介绍,3月7日0时至At 16:00 on March 8th, there were 7 cases of new local new crown pneumonia, including 3 cases of Haidian District and 4 cases of Chaoyang District.Confirmation of diagnosis 1: Now living in Shuangyu Shili Community, Zhongguancun Street, Haidian District.Symptoms such as fever, sore throat on March 6, and symptoms of fever, sore throat, went to Haidian Hospital on March 7 to send a popular kidney consultation. On the same day, the nucleic acid test results were positive and had been transferred to designated hospitals.The results of testing and imaging tests were diagnosed with diagnostic cases that day, and the clinical type was light.Confirmation case 2: Now living in Linxi District 2, Anning West Road, Qinghe Street, Haidian District.On February 25th to 27th, he went to a business trip in other provinces. He reported that diarrhea symptoms occurred on February 27, and fever symptoms occurred on March 2.On March 8th, the close contact with the diagnosis was performed. The test results of the report on the day were positive. It has been transferred to a designated hospital.Confracted cases, clinical classification is light.Confirmation case 3: Now living in West Road, West Road, Qinghe Street, Haidian District, the work location is No. 33 Xisanqi Middle Road, Haidian District.Symptoms such as nausea and retching appeared on March 4th. On March 7, home isolation was performed as risk control staff. The results of the nucleic acid test results on March 8 were positive and had been transferred to designated hospitals.As a result of the results of the imaging examination, the diagnosis of the diagnosis was a confirmed case that day, and the clinical type was light.Confirmation cases 4 to 7: It is a family clustering epidemic.Currently live in Vanke Qingqing Home, Douzhuang Township, Chaoyang District.The confirmed case 4 and 5 are sisters and siblings. On March 7, I went to the Maternal and Child Health Hospital of Tongzhou District to send a popular kidney consultation. The nucleic acid test results were positive.Confracted cases 6 are mothers with confirmed cases 4 and 5.On March 8th, the close contact with the diagnostic case was detected, and the result was positive.The confirmed case 7 is the grandmother of the confirmed case 4 and 5. It is reported that it was reported by the foreign province to return to Beijing on February 28. On March 8, the close contact with the diagnostic case was tested. The result was positive.The above four have been transferred to designated hospitals. The results of the epidemic medical history, clinical manifestations, laboratory testing and imaging examinations are comprehensively diagnosed as confirmed cases.The type is ordinary type.Popular disease investigations and close contact with those have been carried out, investigating the risk points, and classification and control of various types of risk personnel.Copyright and Disclaimer Copyright Statement: The manuscripts of ""intersection, Xinhua Daily and its subsidiary"" or ""Xinhua Newspaper Network"" manuscripts are the exclusive copyright of Xinhua Newspaper Network.Mirror; authorization reprint must indicate the source of ""Xinhua Newspaper"" and retain the electrode of ""Xinhua Newspaper"".Disclaimer: This site reprinted the manuscript only represents the author's personal point of view, which has nothing to do with Xinhua Newspaper.Its originality and the text and content stated in the text have not been confirmed by this site, and the authenticity, integrity, and timelyness of this article and part of the content, part of the content, and the text are not guaranteed or promised.Credit related content by yourself.Contact us │ illegal and bad information reports │ Jiangsu Xinhua Newspaper Media Group Co., Ltd. All rights reserved. Do not copy or mirror Su ICP No. 05012207 Internet news information service license 32120170002 value-added telecommunications business license Su B2-20140164"
One Tula resident with coronavirus was hospitalized in an infectious diseases hospital per day,6/12/2022,,Russian Federation,,"55.757, 37.615",covid19,,https://www.tulapressa.ru/2022/12/odnogo-tulyaka-s-koronavirusom-gospitalizirovali-v-infekcionnyj-gospital-za-sutki/,14,1.0,,coronavirus,,Tula,,"Over the past day, 38 cases of coronavirus have been identified in the Tula region.This was reported by the federal operative.4 people were able to defeat the disease.Not a single patient with a confirmed Covid-19 died.One Tulyak was hospitalized per day.In total, from the beginning of the pandemic in the region 187 231 fell ill and recovered - 181 184. The total number of dead Tulas reached 5,341 by December 5."
"Globally, covid infections surpass 642 billion cases, over 6600000 deaths - RYT9",19/11/2022,,United States,,"38.892, -77.02",covid19,,https://www.ryt9.com/s/iq38/3375560,15,642000000000.0,6600000.0,covid infections,,,surpass,"International News, Saturday November 19, 2022 01:00 - IQ Worldometer (IQ), the latest reporting website collected from public health agencies around the world, stating that the top of the cow virus-19Accumulated around the world, with 642,132,124 cases, while the deceased accumulated at 6,622,262 US, with the highest number of viruses in the world (100,108,704), followed by India (44,668,951).More than 37 million people are infected, such as France, a country with more than 36 million people with infections, including Germany, a country with more than 35 million infected people, including Brazil, a country with a number of more than 26 infections.Millions of income, namely South Korea, a country with more than 23 million people in the United Kingdom, Japan, a country with more than 21 million people with Russia, a country with a number of more than 16 million infected.Income, namely Turkey, a country with a number of more than 13 million people, such as Spain, a country with a number of more than 11 million infected people, including Vietnam, a country with more than 10 million infected people, including Australia.The United States is also the country with the highest number of deaths in the world (1,101,843), followed by Brazil (688,886) India (530,553) Copyright © 2007-2024 Dataxet Limited (Data Set Limited). All rights reserved.SCOM (4.8)| Service agreement  This website uses cookies.Learn more atPrivacy policyAnd the service of using the service"
